<?xml version="1.0" encoding="utf-8" ?>
<!DOCTYPE xml>
<form
  xmlns="http://www.muenchen.de/formbox/forms"
  xmlns:xsi="http://www.w3.org/2001/XMLSchema-instance" xsi:schemaLocation="http://www.muenchen.de/formbox/forms http://www.muenchen.de/formbox/form.xsd">
  <title>Title</title>
  <controls>
    <label>
      <id>Label1</id>
      <title>Label 1</title>
    </label>
    <label>
      <id>Label2</id>
      <title>Label 2</title>
    </label>
    <tabs>
      <id>tab1</id>
      <pages>
        <tab>
          <title>Tab 1</title>
          <tooltip></tooltip>
          <controls>
            <combobox>
              <id>combobox1</id>
              <title>Combobox 1</title>
              <editable>true</editable>
              <option>
                <value>Item1</value>
              </option>
              <option>
                <value>Item2</value>
              </option>
              <option>
                <value>Item3</value>
              </option>
              <option>
                <value>Item4</value>
              </option>
            </combobox>
            <label>
              <id>label1</id>
              <title>Label1</title>
            </label>
            <textfield>
              <id>textfeld1</id>
              <title>Eingabefeld</title>
              <tip></tip>
              <readonly>false</readonly>
              <autofill>Text</autofill>
            </textfield>
          </controls>
        </tab>
        <tab>
          <title>Tab 2</title>
          <controls>
            <checkbox>
              <id>checkbox1</id>
              <label>Checkbox 1</label>
            </checkbox>
            <checkbox>
              <id>checkbox2</id>
              <label>Checkbox 1</label>
            </checkbox>
            <separator>
              <id>separator1</id>
            </separator>
            <hbox>
              <id>hbox1</id>
              <controls>
                <button>
                  <id>button1</id>
                  <label>Button 1</label>
                  <action>openTemplate</action>
                  <value>fragId</value>
                </button>
                <button>
                  <id>button2</id>
                  <label>Button 2</label>
                  <action>openExt</action>
                  <value>explorer.exe</value>
                  <disabled>true</disabled>
                </button>
              </controls>
            </hbox>
          </controls>
        </tab>
      </pages>
    </tabs>
  </controls>
</form>